{
  "$schema": "https://json-schema.org/draft/2020-12/schema",
  "title": "ViewCatalog",
  "description": "Per-view catalog file produced by setup-ddl. Contains outbound references and inbound dependents.",
  "type": "object",
  "required": ["schema", "name", "references", "referenced_by"],
  "properties": {
    "schema": { "type": "string", "description": "Schema name, e.g. silver" },
    "name": { "type": "string", "description": "Object name, e.g. vw_CustomerSales" },
    "ddl_hash": { "type": "string", "description": "SHA-256 of normalized source DDL. Used for diff-aware reexport." },
    "stale": { "type": "boolean", "description": "True when the object was present in a prior extraction but absent in the latest." },
    "references": {
      "type": "object",
      "description": "Outbound: what this view depends on.",
      "required": ["tables", "views", "functions"],
      "properties": {
        "tables": { "$ref": "common.json#/$defs/scoped_ref_list" },
        "views": { "$ref": "common.json#/$defs/scoped_ref_list" },
        "functions": { "$ref": "common.json#/$defs/scoped_ref_list" }
      }
    },
    "referenced_by": {
      "type": "object",
      "description": "Inbound: what references this view.",
      "required": ["procedures", "views", "functions"],
      "properties": {
        "procedures": { "$ref": "common.json#/$defs/scoped_ref_list" },
        "views": { "$ref": "common.json#/$defs/scoped_ref_list" },
        "functions": { "$ref": "common.json#/$defs/scoped_ref_list" }
      }
    },
    "is_materialized_view": { "type": "boolean", "description": "True when this view is a materialized view (Oracle MV or SQL Server indexed view). MVs are treated like tables for scoping/migration." },
    "columns": {
      "type": "array",
      "description": "Column definitions. Present only for materialized views (physical storage).",
      "items": {
        "type": "object",
        "required": ["name", "sql_type", "is_nullable", "is_identity"],
        "properties": {
          "name": { "type": "string" },
          "sql_type": { "type": "string", "description": "Formatted SQL type, e.g. NVARCHAR(50), BIGINT" },
          "is_nullable": { "type": "boolean" },
          "is_identity": { "type": "boolean" }
        }
      }
    },
    "primary_keys": {
      "type": "array",
      "description": "Primary key constraints. Present only for materialized views.",
      "items": {
        "type": "object",
        "required": ["constraint_name", "columns"],
        "properties": {
          "constraint_name": { "type": "string" },
          "columns": { "type": "array", "items": { "type": "string" } }
        }
      }
    },
    "unique_indexes": {
      "type": "array",
      "description": "Unique indexes. Present only for materialized views.",
      "items": {
        "type": "object",
        "required": ["index_name", "columns"],
        "properties": {
          "index_name": { "type": "string" },
          "columns": { "type": "array", "items": { "type": "string" } }
        }
      }
    },
    "scoping": {
      "type": "object",
      "description": "SQL analysis results from analyzing-view skill. Written by discover write-scoping.",
      "properties": {
        "status": {
          "type": "string",
          "enum": ["analyzed", "error"],
          "description": "analyzed = sql_elements populated and persisted; error = DDL parse or CLI failure"
        },
        "sql_elements": {
          "type": ["array", "null"],
          "description": "SQLglot-extracted SQL features from the view SELECT body. Null when needs_llm is true.",
          "items": {
            "type": "object",
            "required": ["type"],
            "properties": {
              "type": {
                "type": "string",
                "enum": ["join", "aggregation", "window_function", "case", "subquery", "cte", "group_by"],
                "description": "SQL feature category"
              },
              "detail": { "type": "string", "description": "Human-readable detail, e.g. join target or function names" }
            }
          }
        },
        "call_tree": {
          "type": "object",
          "description": "Direct source references resolved from catalog refs.",
          "properties": {
            "reads_from": { "type": "array", "items": { "type": "string" }, "description": "Normalized FQNs of source tables" },
            "views_referenced": { "type": "array", "items": { "type": "string" }, "description": "Normalized FQNs of source views" }
          }
        },
        "logic_summary": {
          "type": "string",
          "description": "LLM-written plain-language description of what the view computes."
        },
        "rationale": { "type": "string" },
        "warnings": {
          "type": "array",
          "description": "VIEW_DEPENDS_ON_VIEWS — view references other views; profiling-view should classify dependencies first.",
          "items": { "$ref": "common.json#/$defs/diagnostics_entry" }
        },
        "errors": {
          "type": "array",
          "description": "DDL_PARSE_ERROR — sqlglot failed; CLI_ERROR — discover write-scoping exited non-zero.",
          "items": { "$ref": "common.json#/$defs/diagnostics_entry" }
        }
      }
    },
    "parse_error": { "type": ["string", "null"], "description": "sqlglot parse error message, if the view DDL failed to parse." },
    "warnings": {
      "type": "array",
      "items": { "$ref": "common.json#/$defs/diagnostics_entry" },
      "description": "Diagnostic warnings detected during catalog enrichment."
    },
    "errors": {
      "type": "array",
      "items": { "$ref": "common.json#/$defs/diagnostics_entry" },
      "description": "Diagnostic errors detected during catalog enrichment."
    }
  }
}
