{
  "schema": "silver",
  "name": "vw_daily_sales_summary",
  "is_materialized_view": false,
  "scoping": {
    "status": "analyzed",
    "sql_elements": [
      {
        "type": "aggregation",
        "detail": "SUM(SalesAmount)"
      },
      {
        "type": "group_by",
        "detail": "GROUP BY OrderDateKey, ProductKey"
      }
    ],
    "logic_summary": "Aggregates daily sales by order date and product."
  },
  "references": {
    "tables": {
      "in_scope": [
        {
          "schema": "silver",
          "name": "FactInternetSales"
        }
      ],
      "out_of_scope": []
    },
    "views": {
      "in_scope": [],
      "out_of_scope": []
    },
    "functions": {
      "in_scope": [],
      "out_of_scope": []
    }
  },
  "referenced_by": {
    "procedures": {
      "in_scope": [],
      "out_of_scope": []
    },
    "views": {
      "in_scope": [],
      "out_of_scope": []
    },
    "functions": {
      "in_scope": [],
      "out_of_scope": []
    }
  }
}
